<?xml version="1.0" encoding="UTF-8"?>
<clientContent xmlns:xsi="http://www.w3.org/2001/XMLSchema-instance" xsi:noNamespaceSchemaLocation="clientContent.xsd">
  <documentId>76a3f4be-b9d6-44a1-a6a6-8f478821fca9</documentId>
  <version>1</version>
  <previousVersionId/>
  <nextVersionId/>
  <documentName>ORT Total Hip Replacement/Revision Post-Op - Adult</documentName>
  <clientContentType>uploadedPdf</clientContentType>
  <fileExtension>pdf</fileExtension>
  <locations>
    <uri>/env/1/clientContent/76a3f4be-b9d6-44a1-a6a6-8f478821fca9/uploadedPdf</uri>
  </locations>
  <userFirstName/>
  <userLastName/>
  <authorSpaceVersion/>
  <authorSpaceEnvironmentName/>
  <orderSetFolderPath/>
  <softDeleted>false</softDeleted>
  <createdDateTime>2013-05-03T11:34:00Z</createdDateTime>
</clientContent>